{
  "schema_version": 1,
  "kind": "resolve",
  "data": {
    "url": "http://localhost:8451/webservice/pluginfile.php/15/mod_assign/introattachment/0/rubric.txt",
    "kind": "file",
    "module": null,
    "cmid": null,
    "course_id": null,
    "user_id": null,
    "discussion_id": null,
    "file_name": "rubric.txt",
    "command": "moodle file download http://localhost:8451/webservice/pluginfile.php/15/mod_assign/introattachment/0/rubric.txt"
  },
  "meta": {
    "site": null,
    "account": null,
    "source": "local",
    "partial": false,
    "missing": [],
    "next_cursor": null
  }
}
